{
  "id": "densenet121-cxr-suspicious-binary",
  "name": "DenseNet121 CXR Multi-Label Pathology Demo (Binary Suspicious View)",
  "version": "1.0.0",
  "certified": false,
  "bodypart": "chest",
  "modality": "xray",
  "model": {
    "file": "/models/densenet121-cxr-suspicious-binary/model.onnx",
    "format": "onnx"
  },
  "integrity": {
    "sha256": "753bfe128d1bff010f2b6749d75fb4c4788f1e53cf5deb74d361c0f09200dd50"
  },
  "input": {
    "shape": [
      1,
      1,
      224,
      224
    ],
    "layout": "NCHW",
    "normalize": {
      "mean": [
        0
      ],
      "std": [
        0.00392156863
      ]
    }
  },
  "output": {
    "shape": [
      1,
      2
    ],
    "classes": [
      "No suspicious chest finding",
      "Possible suspicious chest finding"
    ],
    "activation": "softmax"
  },
  "safety": {
    "tier": "screening",
    "disclaimer": "This tool is for screening support only. It does not diagnose cancer or any disease. A possible finding requires clinician review. A no finding result does not rule out disease."
  },
  "thresholds": {
    "possible_finding": 0.5,
    "low_confidence": 0.25,
    "validation_status": "unvalidated"
  },
  "source_model": {
    "family": "DenseNet121",
    "source": "TorchXRayVision densenet121-res224-all",
    "selected_findings": [
      "Nodule",
      "Mass",
      "Lung Lesion",
      "Lung Opacity"
    ]
  }
}
