{
  "id": "resnet50-cxr-suspicious",
  "name": "ResNet50 CXR Multi-Label Pathology Demo",
  "version": "1.0.0",
  "certified": false,
  "bodypart": "chest",
  "modality": "xray",
  "model": {
    "file": "/models/resnet50-cxr-suspicious/model.onnx",
    "format": "onnx"
  },
  "integrity": {
    "sha256": "dd7d500221bcc3ccc3b35eee8b225afe2b3b7b0eefb98dc20766e485c3c76ff1"
  },
  "input": {
    "shape": [
      1,
      1,
      512,
      512
    ],
    "layout": "NCHW",
    "normalize": {
      "mean": [
        0
      ],
      "std": [
        0.00392156863
      ]
    }
  },
  "output": {
    "task": "multilabel",
    "shape": [
      1,
      18
    ],
    "classes": [
      "Atelectasis",
      "Consolidation",
      "Infiltration",
      "Pneumothorax",
      "Edema",
      "Emphysema",
      "Fibrosis",
      "Effusion",
      "Pneumonia",
      "Pleural_Thickening",
      "Cardiomegaly",
      "Nodule",
      "Mass",
      "Hernia",
      "Lung Lesion",
      "Fracture",
      "Lung Opacity",
      "Enlarged Cardiomediastinum"
    ],
    "activation": "none",
    "labels": [
      {
        "name": "Atelectasis",
        "threshold": 0.5,
        "suspicious": true
      },
      {
        "name": "Consolidation",
        "threshold": 0.5,
        "suspicious": true
      },
      {
        "name": "Infiltration",
        "threshold": 0.5,
        "suspicious": true
      },
      {
        "name": "Pneumothorax",
        "threshold": 0.5,
        "suspicious": true
      },
      {
        "name": "Edema",
        "threshold": 0.5,
        "suspicious": true
      },
      {
        "name": "Emphysema",
        "threshold": 0.5,
        "suspicious": true
      },
      {
        "name": "Fibrosis",
        "threshold": 0.5,
        "suspicious": true
      },
      {
        "name": "Effusion",
        "threshold": 0.5,
        "suspicious": true
      },
      {
        "name": "Pneumonia",
        "threshold": 0.5,
        "suspicious": true
      },
      {
        "name": "Pleural_Thickening",
        "threshold": 0.5,
        "suspicious": true
      },
      {
        "name": "Cardiomegaly",
        "threshold": 0.5,
        "suspicious": true
      },
      {
        "name": "Nodule",
        "threshold": 0.5,
        "suspicious": true
      },
      {
        "name": "Mass",
        "threshold": 0.5,
        "suspicious": true
      },
      {
        "name": "Hernia",
        "threshold": 0.5,
        "suspicious": true
      },
      {
        "name": "Lung Lesion",
        "threshold": 0.5,
        "suspicious": true
      },
      {
        "name": "Fracture",
        "threshold": 0.5,
        "suspicious": true
      },
      {
        "name": "Lung Opacity",
        "threshold": 0.5,
        "suspicious": true
      },
      {
        "name": "Enlarged Cardiomediastinum",
        "threshold": 0.5,
        "suspicious": true
      }
    ]
  },
  "safety": {
    "tier": "research",
    "disclaimer": "This tool is for screening support only. It does not diagnose cancer or any disease. A possible finding requires clinician review. A no finding result does not rule out disease."
  },
  "thresholds": {
    "possible_finding": 0.5,
    "low_confidence": 0.25,
    "validation_status": "unvalidated"
  },
  "source_model": {
    "family": "ResNet50",
    "source": "TorchXRayVision resnet50-res512-all",
    "selected_findings": [
      "Nodule",
      "Mass",
      "Lung Lesion",
      "Lung Opacity"
    ]
  }
}
